[
  {
    "key": "opal_fare_2025",
    "title": "Your Opal fare has changed",
    "description": "Starting 14 July 2025, Opal fares have been increased by 2.5% for the annual consumer price index (CPI) movement.",
    "type": "INFO",
    "endDate": "2025-12-31",
    "dismissCtaText": "Dismiss",
    "primaryCta": {
      "text": "Read more",
      "url": "https://transportnsw.info/news/2025/opal-fare-changes-from-14-july"
    }
  },
  {
    "key": "trackwork_city_trains_OCT_2025",
    "title": "Trackwork – City Trains Oct 31 – Nov 2",
    "description": "Trackwork will affect train services to and from the City from Friday 31 October to Sunday 2 November. Use \"Plan your trip\" feature before travelling.",
    "type": "INFO",
    "endDate": "2025-11-02",
    "dismissCtaText": "Dismiss",
    "primaryCta": {
      "text": "Read more",
      "url": "https://transportnsw.info/news/2025/trackwork-may-impact-your-travel-to-city-from-friday-31-october-to-sunday-2-november"
    }
  }
]
